{
  "$schema": "https://json-schema.org/draft/2020-12/schema",
  "$id": "https://agentic-coding-tools.local/contracts/review-cache-layout.schema.json",
  "title": "ReviewCacheManifest",
  "description": "Manifest for an on-disk vendor-findings checkpoint. Superset of the manifest currently written by review_dispatcher.py:write_manifest() — preserves all existing fields (review_type, target, dispatches[], quorum_requested, quorum_received) AND adds new fields needed for the in-process converge() flow (schema_version, change_id, created_at, vendors[]). After this proposal lands, both the CLI dispatcher and in-process converge() write the same superset shape via the shared checkpoint_findings helper. Legacy manifests written by older versions of review_dispatcher.py (lacking schema_version etc.) are NOT covered by this schema; they predate the proposal and will be regenerated next time the dispatcher runs.",
  "type": "object",
  "required": [
    "schema_version",
    "review_type",
    "created_at",
    "vendors",
    "target",
    "dispatches",
    "quorum_requested",
    "quorum_received"
  ],
  "additionalProperties": false,
  "properties": {
    "schema_version": {
      "type": "integer",
      "const": 1,
      "description": "Layout version. Readers MUST refuse unknown versions. Bump triggers a schema migration."
    },
    "change_id": {
      "type": ["string", "null"],
      "description": "OpenSpec change-id this checkpoint belongs to. OPTIONAL because the existing review_dispatcher.py CLI has no change_id concept (it uses `target` for generic feature/package identifiers). In-process callers SHALL populate this field; CLI callers MAY omit or pass null."
    },
    "review_type": {
      "type": "string",
      "enum": ["plan", "implementation"],
      "description": "Which review phase produced these findings."
    },
    "created_at": {
      "type": "string",
      "format": "date-time",
      "description": "ISO-8601 UTC timestamp when the manifest was written."
    },

    "target": {
      "type": "string",
      "minLength": 1,
      "description": "Existing field preserved from review_dispatcher.py. Typically equal to change_id; the existing CLI uses 'target' as a generic feature/package identifier."
    },
    "dispatches": {
      "type": "array",
      "description": "Existing field preserved from review_dispatcher.py. Per-vendor dispatch metadata (model used, latency, error class). MAY be empty when written by an in-process caller without dispatch metadata.",
      "items": {
        "type": "object",
        "required": ["vendor", "success"],
        "additionalProperties": false,
        "properties": {
          "vendor": {"type": "string", "minLength": 1},
          "success": {"type": "boolean"},
          "model_used": {"type": ["string", "null"]},
          "models_attempted": {
            "type": "array",
            "items": {"type": "string"}
          },
          "elapsed_seconds": {"type": ["number", "null"]},
          "error": {"type": ["string", "null"]},
          "error_class": {"type": ["string", "null"]}
        }
      }
    },
    "quorum_requested": {
      "type": "integer",
      "minimum": 0,
      "description": "Existing field preserved from review_dispatcher.py."
    },
    "quorum_received": {
      "type": "integer",
      "minimum": 0,
      "description": "Existing field preserved from review_dispatcher.py."
    },

    "vendors": {
      "type": "array",
      "description": "NEW field. Index of per-vendor finding files for the fallback CLI to enumerate. MAY be empty for empty review rounds.",
      "items": {
        "type": "object",
        "required": ["name", "findings_path", "finding_count"],
        "additionalProperties": false,
        "properties": {
          "name": {
            "type": "string",
            "minLength": 1,
            "pattern": "^[A-Za-z0-9_-]+$",
            "description": "Vendor identifier. Pattern enforced for path safety (no separators, no dots, no spaces)."
          },
          "findings_path": {
            "type": "string",
            "pattern": "^findings-[A-Za-z0-9_-]+-(plan|implementation)\\.json$",
            "description": "Relative filename under .review-cache/ for this vendor's findings. MUST be a simple filename (no directory components, no '..')."
          },
          "finding_count": {
            "type": "integer",
            "minimum": 0,
            "description": "Number of findings in the per-vendor file. Used for sanity checks."
          }
        }
      }
    }
  }
}
