{
  "schema_version": 1,
  "change_id": null,
  "review_type": "implementation",
  "created_at": "2026-09-14T08:19:46Z",
  "target": "cli-dispatch",
  "dispatches": [
    {
      "vendor": "antigravity",
      "success": false,
      "model_used": "gemini-3.8-flash-high",
      "models_attempted": [
        "gemini-3.8-flash-high"
      ],
      "elapsed_seconds": 301.6407841700129,
      "error": "Invalid JSON output: {\"conversation_id\":\"94283160-6e30-4894-9c8d-a245613537da\",\"status\":\"SUCCESS\",\"response\":\"\",\"duration_seconds\":296.311852079,\"num_turns\":1,\"json_schema\":{\"type\":\"object\",\"required\":[\"findings\"],\"properties\":{\"findings\":{\"type\":\"array\",\"items\":{\"type\":\"object\",\"required\":[\"id\",\"type\",\"criticality\",\"description\",\"disposition\",\"axis\",\"severity\"],\"properties\":{\"id\":{\"type\":\"integer\"},\"type\":{\"type\":\"string\",\"enum\":[\"spec_gap\",\"contract_mismatch\",\"architecture\",\"security\",\"performance\",\"style\",\"correc",
      "error_class": null
    },
    {
      "vendor": "claude_code",
      "success": true,
      "model_used": "fable",
      "models_attempted": [
        "fable"
      ],
      "elapsed_seconds": 601.4463793439791,
      "error": null,
      "error_class": null
    },
    {
      "vendor": "codex",
      "success": true,
      "model_used": "gpt-5.6-sol",
      "models_attempted": [
        "gpt-5.6-sol"
      ],
      "elapsed_seconds": 865.2980082221329,
      "error": null,
      "error_class": null
    },
    {
      "vendor": "grok",
      "success": true,
      "model_used": "grok-4.5",
      "models_attempted": [
        "grok-4.5"
      ],
      "elapsed_seconds": 396.57581450790167,
      "error": null,
      "error_class": null
    },
    {
      "vendor": "pi",
      "success": false,
      "model_used": "nvidia/nemotron-3-ultra-550b-a55b",
      "models_attempted": [
        "nvidia/nemotron-3-ultra-550b-a55b"
      ],
      "elapsed_seconds": 420.79137409105897,
      "error": "{\"type\":\"session\",\"version\":3,\"id\":\"01a09ef3-0401-7306-bf5e-42f53cd559be\",\"timestamp\":\"2026-09-14T08:05:21.537Z\",\"cwd\":\"/home/jankneumann/Coding/agentic-coding-tools/.git-worktrees/recover-ri-09-work-queue-projection\"}\n{\"type\":\"agent_start\"}\n{\"type\":\"turn_start\"}\n{\"type\":\"message_start\",\"message\":{\"role\":\"user\",\"content\":[{\"type\":\"text\",\"text\":\"Fresh independent read-only implementation recovery review for\\n`mirror-autopilot-phase-state-into-the-work-queue` at exact HEAD\\n`b796aaeddb0caa89576395",
      "error_class": "auth_required"
    }
  ],
  "quorum_requested": 5,
  "quorum_received": 3,
  "vendors": [
    {
      "name": "claude_code",
      "findings_path": "findings-claude_code-implementation.json",
      "finding_count": 20
    },
    {
      "name": "codex",
      "findings_path": "findings-codex-implementation.json",
      "finding_count": 7
    },
    {
      "name": "grok",
      "findings_path": "findings-grok-implementation.json",
      "finding_count": 12
    }
  ]
}