{
  "schema_version": 1,
  "change_id": null,
  "review_type": "implementation",
  "created_at": "2026-07-27T15:11:34Z",
  "target": "cli-dispatch",
  "dispatches": [
    {
      "vendor": "antigravity",
      "success": false,
      "model_used": "gemini-3.6-flash-medium",
      "models_attempted": [
        "gemini-3.6-flash-medium"
      ],
      "elapsed_seconds": 158.21265129104722,
      "error": "Invalid JSON output",
      "error_class": null
    },
    {
      "vendor": "codex",
      "success": true,
      "model_used": "gpt-5.5",
      "models_attempted": [
        "gpt-5.5"
      ],
      "elapsed_seconds": 693.9783721249551,
      "error": null,
      "error_class": null
    },
    {
      "vendor": "grok",
      "success": true,
      "model_used": "grok-4.5",
      "models_attempted": [
        "grok-4.5"
      ],
      "elapsed_seconds": 663.0935874579009,
      "error": null,
      "error_class": null
    },
    {
      "vendor": "pi",
      "success": true,
      "model_used": "qwen/qwen3-coder",
      "models_attempted": [
        "qwen/qwen3-coder"
      ],
      "elapsed_seconds": 541.2176762499148,
      "error": null,
      "error_class": null
    }
  ],
  "quorum_requested": 4,
  "quorum_received": 3,
  "vendors": [
    {
      "name": "codex",
      "findings_path": "findings-codex-implementation.json",
      "finding_count": 16
    },
    {
      "name": "grok",
      "findings_path": "findings-grok-implementation.json",
      "finding_count": 19
    },
    {
      "name": "pi",
      "findings_path": "findings-pi-implementation.json",
      "finding_count": 14
    }
  ]
}