{
  "schema_version": 1,
  "change_id": null,
  "review_type": "implementation",
  "created_at": "2026-09-11T03:26:24Z",
  "target": "cli-dispatch",
  "dispatches": [
    {
      "vendor": "grok",
      "success": false,
      "model_used": null,
      "models_attempted": [
        "grok-4.5"
      ],
      "elapsed_seconds": 180.0394344208762,
      "error": "Timeout after 180s",
      "error_class": "transient"
    },
    {
      "vendor": "pi",
      "success": false,
      "model_used": "qwen/qwen3-coder",
      "models_attempted": [
        "qwen/qwen3-coder"
      ],
      "elapsed_seconds": 34.26390267489478,
      "error": "Findings failed review-findings schema validation: findings/0: 'id' is a required property; findings/0: 'type' is a required property; findings/0: 'criticality' is a required property; findings/0: 'description' is a required property; findings/0: 'disposition' is a required property",
      "error_class": null
    }
  ],
  "quorum_requested": 2,
  "quorum_received": 0,
  "vendors": []
}