{
  "schema_version": 1,
  "change_id": null,
  "review_type": "plan",
  "created_at": "2026-09-03T10:30:01Z",
  "target": "cli-dispatch",
  "dispatches": [
    {
      "vendor": "antigravity",
      "success": true,
      "model_used": "gemini-3.6-flash-medium",
      "models_attempted": [
        "gemini-3.6-flash-medium"
      ],
      "elapsed_seconds": 105.31937227607705,
      "error": null,
      "error_class": null
    },
    {
      "vendor": "codex",
      "success": false,
      "model_used": null,
      "models_attempted": [
        "gpt-5.5"
      ],
      "elapsed_seconds": 2.656985198846087,
      "error": "Reading additional input from stdin...\nOpenAI Codex v0.150.1\n--------\nworkdir: /home/jankneumann/Coding/agentic-coding-tools/.git-worktrees/route-supervise-gates-through-the-approval-gate-service\nmodel: gpt-5.5\nprovider: openai\napproval: on-request\nsandbox: read-only\nreasoning effort: medium\nreasoning summaries: none\nsession id: 01a066c9-357b-7d32-b91a-bb68eaeae575\n--------\nuser\n# Plan Review: route-supervise-gates-through-the-approval-gate-service (round 3, final)\n\nYou are an independent plan r",
      "error_class": "unknown"
    },
    {
      "vendor": "grok",
      "success": true,
      "model_used": "grok-4.5",
      "models_attempted": [
        "grok-4.5"
      ],
      "elapsed_seconds": 454.3018080999609,
      "error": null,
      "error_class": null
    },
    {
      "vendor": "pi",
      "success": false,
      "model_used": null,
      "models_attempted": [
        "qwen/qwen3-coder"
      ],
      "elapsed_seconds": 87.04878473700956,
      "error": "Auth expired. Run: set OPENROUTER_API_KEY in the environment (pi has no login subcommand)",
      "error_class": "auth_required"
    }
  ],
  "quorum_requested": 4,
  "quorum_received": 2,
  "vendors": [
    {
      "name": "antigravity",
      "findings_path": "findings-antigravity-plan.json",
      "finding_count": 3
    },
    {
      "name": "grok",
      "findings_path": "findings-grok-plan.json",
      "finding_count": 7
    }
  ]
}