{
  "schema_version": 1,
  "change_id": null,
  "review_type": "plan",
  "created_at": "2026-07-28T15:18:00Z",
  "target": "cli-dispatch",
  "dispatches": [
    {
      "vendor": "antigravity",
      "success": true,
      "model_used": "gemini-3.6-flash-medium",
      "models_attempted": [
        "gemini-3.6-flash-medium"
      ],
      "elapsed_seconds": 81.71470433403738,
      "error": null,
      "error_class": null
    },
    {
      "vendor": "codex",
      "success": true,
      "model_used": "gpt-5.5",
      "models_attempted": [
        "gpt-5.5"
      ],
      "elapsed_seconds": 315.04335512500256,
      "error": null,
      "error_class": null
    },
    {
      "vendor": "grok",
      "success": true,
      "model_used": "grok-4.5",
      "models_attempted": [
        "grok-4.5"
      ],
      "elapsed_seconds": 312.3128615000751,
      "error": null,
      "error_class": null
    },
    {
      "vendor": "pi",
      "success": false,
      "model_used": "qwen/qwen3-coder",
      "models_attempted": [
        "qwen/qwen3-coder"
      ],
      "elapsed_seconds": 1.6186864579794928,
      "error": "Invalid JSON output",
      "error_class": null
    }
  ],
  "quorum_requested": 4,
  "quorum_received": 3,
  "vendors": [
    {
      "name": "antigravity",
      "findings_path": "findings-antigravity-plan.json",
      "finding_count": 5
    },
    {
      "name": "codex",
      "findings_path": "findings-codex-plan.json",
      "finding_count": 5
    },
    {
      "name": "grok",
      "findings_path": "findings-grok-plan.json",
      "finding_count": 11
    }
  ]
}