{
  "schema_version": 1,
  "change_id": null,
  "review_type": "implementation",
  "created_at": "2026-09-14T13:05:43Z",
  "target": "cli-dispatch",
  "dispatches": [
    {
      "vendor": "antigravity",
      "success": true,
      "model_used": "gemini-3.8-flash-high",
      "models_attempted": [
        "gemini-3.8-flash-high"
      ],
      "elapsed_seconds": 303.18207679269835,
      "error": null,
      "error_class": null
    },
    {
      "vendor": "claude_code",
      "success": false,
      "model_used": null,
      "models_attempted": [
        "fable"
      ],
      "elapsed_seconds": 2.462777085136622,
      "error": "Unknown error",
      "error_class": "unknown"
    },
    {
      "vendor": "codex",
      "success": true,
      "model_used": "gpt-5.6-sol",
      "models_attempted": [
        "gpt-5.6-sol"
      ],
      "elapsed_seconds": 789.9895628271624,
      "error": null,
      "error_class": null
    },
    {
      "vendor": "grok",
      "success": true,
      "model_used": "grok-4.5",
      "models_attempted": [
        "grok-4.5"
      ],
      "elapsed_seconds": 660.4729796308093,
      "error": null,
      "error_class": null
    },
    {
      "vendor": "pi",
      "success": false,
      "model_used": "nvidia/nemotron-3-ultra-550b-a55b",
      "models_attempted": [
        "nvidia/nemotron-3-ultra-550b-a55b"
      ],
      "elapsed_seconds": 193.3502092533745,
      "error": "{\"type\":\"session\",\"version\":3,\"id\":\"01a09ff9-f333-7044-8f1e-317fd9050e87\",\"timestamp\":\"2026-09-14T12:52:33.203Z\",\"cwd\":\"/home/jankneumann/Coding/agentic-coding-tools/.git-worktrees/recover-ri-09-work-queue-projection\"}\n{\"type\":\"agent_start\"}\n{\"type\":\"turn_start\"}\n{\"type\":\"message_start\",\"message\":{\"role\":\"user\",\"content\":[{\"type\":\"text\",\"text\":\"Final independent read-only implementation convergence review for\\n`mirror-autopilot-phase-state-into-the-work-queue` at exact HEAD\\n`34f3e5c74d88fd2d252",
      "error_class": "auth_required"
    }
  ],
  "quorum_requested": 5,
  "quorum_received": 3,
  "vendors": [
    {
      "name": "antigravity",
      "findings_path": "findings-antigravity-implementation.json",
      "finding_count": 13
    },
    {
      "name": "codex",
      "findings_path": "findings-codex-implementation.json",
      "finding_count": 13
    },
    {
      "name": "grok",
      "findings_path": "findings-grok-implementation.json",
      "finding_count": 12
    }
  ]
}