{
  "schema_version": 1,
  "change_id": "add-coordinator-kanban-viz",
  "review_type": "plan",
  "created_at": "2026-05-17T01:34:35Z",
  "target": "add-coordinator-kanban-viz",
  "dispatches": [
    {
      "vendor": "claude_code",
      "success": true,
      "model_used": "(default)",
      "models_attempted": [
        "(default)"
      ],
      "elapsed_seconds": 130.22211312496802,
      "error": null,
      "error_class": null
    },
    {
      "vendor": "codex",
      "success": true,
      "model_used": "gpt-5.5",
      "models_attempted": [
        "gpt-5.5"
      ],
      "elapsed_seconds": 117.04341479198774,
      "error": null,
      "error_class": null
    },
    {
      "vendor": "gemini",
      "success": true,
      "model_used": "gemini-3-flash-preview",
      "models_attempted": [
        "gemini-3-flash-preview"
      ],
      "elapsed_seconds": 23.198359749978408,
      "error": null,
      "error_class": null
    }
  ],
  "quorum_requested": 3,
  "quorum_received": 3,
  "vendors": [
    {
      "name": "claude_code",
      "findings_path": "findings-claude_code-plan.json",
      "finding_count": 15
    },
    {
      "name": "codex",
      "findings_path": "findings-codex-plan.json",
      "finding_count": 7
    },
    {
      "name": "gemini",
      "findings_path": "findings-gemini-plan.json",
      "finding_count": 7
    }
  ]
}