{
  "schema_version": 1,
  "change_id": null,
  "review_type": "implementation",
  "created_at": "2026-09-13T12:23:51Z",
  "target": "cli-dispatch",
  "dispatches": [
    {
      "vendor": "antigravity",
      "success": false,
      "model_used": null,
      "models_attempted": [
        "gemini-3.6-flash-medium"
      ],
      "elapsed_seconds": 0.07680193474516273,
      "error": "Error: --json-schema can only be used when --output-format is 'json' or 'stream-json'\n",
      "error_class": "unknown"
    },
    {
      "vendor": "claude_code",
      "success": true,
      "model_used": "(default)",
      "models_attempted": [
        "(default)"
      ],
      "elapsed_seconds": 337.22964375512674,
      "error": null,
      "error_class": null
    },
    {
      "vendor": "grok",
      "success": true,
      "model_used": "grok-4.5",
      "models_attempted": [
        "grok-4.5"
      ],
      "elapsed_seconds": 197.89577386900783,
      "error": null,
      "error_class": null
    },
    {
      "vendor": "pi",
      "success": false,
      "model_used": null,
      "models_attempted": [
        "qwen/qwen3-coder"
      ],
      "elapsed_seconds": 203.04548944812268,
      "error": "Auth expired. Run: set OPENROUTER_API_KEY in the environment (pi has no login subcommand)",
      "error_class": "auth_required"
    }
  ],
  "quorum_requested": 4,
  "quorum_received": 2,
  "vendors": [
    {
      "name": "claude_code",
      "findings_path": "findings-claude_code-implementation.json",
      "finding_count": 7
    },
    {
      "name": "grok",
      "findings_path": "findings-grok-implementation.json",
      "finding_count": 0
    }
  ]
}