{
  "schema_version": 1,
  "change_id": null,
  "review_type": "implementation",
  "created_at": "2026-09-01T07:24:19Z",
  "target": "cli-dispatch",
  "dispatches": [
    {
      "vendor": "pi",
      "success": false,
      "model_used": null,
      "models_attempted": [
        "qwen/qwen3-coder"
      ],
      "elapsed_seconds": 30.01717147906311,
      "error": "Timeout after 30s",
      "error_class": "transient"
    }
  ],
  "quorum_requested": 1,
  "quorum_received": 0,
  "vendors": []
}