{
  "schema_version": 1,
  "change_id": "harden-review-consensus-and-recovery",
  "review_type": "plan",
  "created_at": "2026-08-01T20:51:02Z",
  "target": "harden-review-consensus-and-recovery",
  "dispatches": [
    {
      "vendor": "antigravity",
      "success": false,
      "model_used": null,
      "models_attempted": [],
      "elapsed_seconds": 600,
      "error": "External review exceeded the documented 600-second per-vendor bound. The dispatcher applied the timeout per model attempt and remained blocked in Antigravity's model loop, so the outer run was interrupted after the bound failed.",
      "error_class": "timeout"
    },
    {
      "vendor": "claude_code",
      "success": false,
      "model_used": null,
      "models_attempted": [],
      "elapsed_seconds": 0,
      "error": "Not dispatched because the sequential dispatcher remained blocked beyond the prior vendor's documented timeout.",
      "error_class": "not_dispatched"
    },
    {
      "vendor": "grok",
      "success": false,
      "model_used": null,
      "models_attempted": [],
      "elapsed_seconds": 0,
      "error": "Not dispatched because the sequential dispatcher remained blocked beyond the prior vendor's documented timeout.",
      "error_class": "not_dispatched"
    },
    {
      "vendor": "pi",
      "success": false,
      "model_used": null,
      "models_attempted": [],
      "elapsed_seconds": 0,
      "error": "Not dispatched because the sequential dispatcher remained blocked beyond the prior vendor's documented timeout.",
      "error_class": "not_dispatched"
    }
  ],
  "quorum_requested": 4,
  "quorum_received": 0,
  "vendors": []
}
