{
  "schema_version": 1,
  "change_id": null,
  "review_type": "plan",
  "created_at": "2026-06-05T15:29:14Z",
  "target": "cli-dispatch",
  "dispatches": [
    {
      "vendor": "codex",
      "success": true,
      "model_used": "gpt-5.5",
      "models_attempted": [
        "gpt-5.5"
      ],
      "elapsed_seconds": 115.43216708407272,
      "error": null,
      "error_class": null
    },
    {
      "vendor": "gemini",
      "success": true,
      "model_used": "gemini-3-flash-preview",
      "models_attempted": [
        "gemini-3-flash-preview"
      ],
      "elapsed_seconds": 58.2862009590026,
      "error": null,
      "error_class": null
    }
  ],
  "quorum_requested": 2,
  "quorum_received": 2,
  "vendors": [
    {
      "name": "codex",
      "findings_path": "findings-codex-plan.json",
      "finding_count": 6
    },
    {
      "name": "gemini",
      "findings_path": "findings-gemini-plan.json",
      "finding_count": 5
    }
  ]
}