{
  "schema_version": 1,
  "change_id": null,
  "review_type": "plan",
  "created_at": "2026-09-11T04:43:23Z",
  "target": "cli-dispatch",
  "dispatches": [
    {
      "vendor": "antigravity",
      "success": false,
      "model_used": "gemini-3.6-flash-medium",
      "models_attempted": [
        "gemini-3.6-flash-medium"
      ],
      "elapsed_seconds": 302.176029574126,
      "error": "Invalid JSON output: [agy] print timeout after 5m0s with turn in progress; returning partial output",
      "error_class": null
    },
    {
      "vendor": "codex",
      "success": true,
      "model_used": "gpt-5.5",
      "models_attempted": [
        "gpt-5.5"
      ],
      "elapsed_seconds": 319.723908605054,
      "error": null,
      "error_class": null
    },
    {
      "vendor": "grok",
      "success": false,
      "model_used": null,
      "models_attempted": [
        "grok-4.5"
      ],
      "elapsed_seconds": 900.1091835838743,
      "error": "Timeout after 900s",
      "error_class": "transient"
    },
    {
      "vendor": "pi",
      "success": true,
      "model_used": "qwen/qwen3-coder",
      "models_attempted": [
        "qwen/qwen3-coder"
      ],
      "elapsed_seconds": 48.731984129175544,
      "error": null,
      "error_class": null
    }
  ],
  "quorum_requested": 4,
  "quorum_received": 2,
  "vendors": [
    {
      "name": "codex",
      "findings_path": "findings-codex-plan.json",
      "finding_count": 4
    },
    {
      "name": "pi",
      "findings_path": "findings-pi-plan.json",
      "finding_count": 0
    }
  ]
}